Location,Description,Severity,
undefined,undefined,"Hosur Road, Arab Lines, Richmond Town, Bengaluru, Bangalore North, Bengaluru Urban, Karnataka, 560025, India - 12.959744,77.6077312"
"HMT Quarters, Jalahalli, Bengaluru, Bangalore North, Bengaluru Urban, Karnataka, 560013, India - 13.0482176,77.5389184","ghghghgg","Low",
"KMV Red Hills High School, Acharya Dr Sarvepalli Radhakrishnan Road, Geleyara Balaga Layout, Chikka Banavara, Bangalore North, Bengaluru Urban, Karnataka, 560090, India - 13.0741421,77.5015635","Fieowjjd","High",
"HMT Quarters, Jalahalli, Bengaluru, Bangalore North, Bengaluru Urban, Karnataka, 560013, India - 13.0482176,77.5389184","test data","Medium"
"HMT Quarters, Jalahalli, Bengaluru, Bangalore North, Bengaluru Urban, Karnataka, 560013, India - 13.0482176,77.5389184","fasdf","Medium"
